   11 4.380803302 192.168.8.128 → 192.168.8.1  TCP 74 58822 → 80 [SYN] Seq=0 Win=29200 Len=0 MSS=1460 SACK_PERM=1 TSval=1266750535 TSecr=0 WS=128
   52 12.386262229 192.168.8.128 → 192.168.8.1  TCP 74 58824 → 80 [SYN] Seq=0 Win=29200 Len=0 MSS=1460 SACK_PERM=1 TSval=1266758538 TSecr=0 WS=128
  107 20.904138093 192.168.8.128 → 172.217.6.225 TCP 74 35160 → 443 [SYN] Seq=0 Win=29200 Len=0 MSS=1460 SACK_PERM=1 TSval=198687722 TSecr=0 WS=128
  109 20.905438080 192.168.8.128 → 172.217.12.150 TCP 74 41828 → 443 [SYN] Seq=0 Win=29200 Len=0 MSS=1460 SACK_PERM=1 TSval=2492548256 TSecr=0 WS=128
  111 20.907148064 192.168.8.128 → 172.217.12.131 TCP 74 52318 → 443 [SYN] Seq=0 Win=29200 Len=0 MSS=1460 SACK_PERM=1 TSval=576310975 TSecr=0 WS=128
  145 20.932577815 192.168.8.128 → 172.217.10.234 TCP 74 33352 → 443 [SYN] Seq=0 Win=29200 Len=0 MSS=1460 SACK_PERM=1 TSval=2942524258 TSecr=0 WS=128
  443 28.054861250 192.168.8.128 → 23.203.100.50 TCP 74 44330 → 443 [SYN] Seq=0 Win=29200 Len=0 MSS=1460 SACK_PERM=1 TSval=4004534813 TSecr=0 WS=128
  534 28.373861133 192.168.8.128 → 13.225.226.34 TCP 74 58390 → 443 [SYN] Seq=0 Win=29200 Len=0 MSS=1460 SACK_PERM=1 TSval=2056549216 TSecr=0 WS=128
  540 28.383781036 192.168.8.128 → 13.225.226.34 TCP 74 58392 → 443 [SYN] Seq=0 Win=29200 Len=0 MSS=1460 SACK_PERM=1 TSval=2056549226 TSecr=0 WS=128
  541 28.385304021 192.168.8.128 → 13.225.226.34 TCP 74 58394 → 443 [SYN] Seq=0 Win=29200 Len=0 MSS=1460 SACK_PERM=1 TSval=2056549228 TSecr=0 WS=128
  550 28.443929448 192.168.8.128 → 13.225.226.34 TCP 74 58396 → 443 [SYN] Seq=0 Win=29200 Len=0 MSS=1460 SACK_PERM=1 TSval=2056549286 TSecr=0 WS=128
  553 28.449954390 192.168.8.128 → 13.225.226.34 TCP 74 58398 → 443 [SYN] Seq=0 Win=29200 Len=0 MSS=1460 SACK_PERM=1 TSval=2056549292 TSecr=0 WS=128
  600 28.527362633 192.168.8.128 → 13.225.226.34 TCP 74 58400 → 443 [SYN] Seq=0 Win=29200 Len=0 MSS=1460 SACK_PERM=1 TSval=2056549364 TSecr=0 WS=128
  740 29.369895401 192.168.8.128 → 192.168.8.1  TCP 74 58848 → 80 [SYN] Seq=0 Win=29200 Len=0 MSS=1460 SACK_PERM=1 TSval=1266775524 TSecr=0 WS=128
  762 30.300140310 192.168.8.128 → 3.224.158.140 TCP 74 58366 → 443 [SYN] Seq=0 Win=29200 Len=0 MSS=1460 SACK_PERM=1 TSval=540449099 TSecr=0 WS=128
  763 30.307332240 192.168.8.128 → 3.224.158.140 TCP 74 58368 → 443 [SYN] Seq=0 Win=29200 Len=0 MSS=1460 SACK_PERM=1 TSval=540449106 TSecr=0 WS=128
  770 30.322517091 192.168.8.128 → 3.224.158.140 TCP 74 58370 → 443 [SYN] Seq=0 Win=29200 Len=0 MSS=1460 SACK_PERM=1 TSval=540449121 TSecr=0 WS=128
  838 30.521906143 192.168.8.128 → 52.94.228.73 TCP 74 60980 → 443 [SYN] Seq=0 Win=29200 Len=0 MSS=1460 SACK_PERM=1 TSval=3235999229 TSecr=0 WS=128
  985 37.370360194 192.168.8.128 → 192.168.8.1  TCP 74 58858 → 80 [SYN] Seq=0 Win=29200 Len=0 MSS=1460 SACK_PERM=1 TSval=1266783525 TSecr=0 WS=128
 1013 41.831994555 192.168.8.128 → 173.194.131.39 TCP 74 48936 → 443 [SYN] Seq=0 Win=29200 Len=0 MSS=1460 SACK_PERM=1 TSval=3714759175 TSecr=0 WS=128
 1124 44.897397563 192.168.8.128 → 173.194.31.233 TCP 74 36900 → 443 [SYN] Seq=0 Win=29200 Len=0 MSS=1460 SACK_PERM=1 TSval=154319391 TSecr=0 WS=128
 1125 44.897765560 192.168.8.128 → 173.194.31.233 TCP 74 36902 → 443 [SYN] Seq=0 Win=29200 Len=0 MSS=1460 SACK_PERM=1 TSval=154319391 TSecr=0 WS=128
 1308 45.304715577 192.168.8.128 → 192.168.8.1  TCP 74 58866 → 80 [SYN] Seq=0 Win=29200 Len=0 MSS=1460 SACK_PERM=1 TSval=1266791459 TSecr=0 WS=128
 1346 47.981585379 192.168.8.128 → 173.194.185.199 TCP 74 52006 → 443 [SYN] Seq=0 Win=29200 Len=0 MSS=1460 SACK_PERM=1 TSval=3209191804 TSecr=0 WS=128
 1347 47.981957375 192.168.8.128 → 173.194.185.199 TCP 74 52008 → 443 [SYN] Seq=0 Win=29200 Len=0 MSS=1460 SACK_PERM=1 TSval=3209191804 TSecr=0 WS=128
 1555 50.456667150 192.168.8.128 → 173.194.185.168 TCP 74 39766 → 443 [SYN] Seq=0 Win=29200 Len=0 MSS=1460 SACK_PERM=1 TSval=950700644 TSecr=0 WS=128
 1556 50.457179145 192.168.8.128 → 173.194.185.168 TCP 74 39768 → 443 [SYN] Seq=0 Win=29200 Len=0 MSS=1460 SACK_PERM=1 TSval=950700644 TSecr=0 WS=128
 1773 55.291632804 192.168.8.128 → 192.168.8.1  TCP 74 58876 → 80 [SYN] Seq=0 Win=29200 Len=0 MSS=1460 SACK_PERM=1 TSval=1266801445 TSecr=0 WS=128
 1827 64.299820540 192.168.8.128 → 192.168.8.1  TCP 74 58878 → 80 [SYN] Seq=0 Win=29200 Len=0 MSS=1460 SACK_PERM=1 TSval=1266810454 TSecr=0 WS=128
 1872 72.291889175 192.168.8.128 → 192.168.8.1  TCP 74 58880 → 80 [SYN] Seq=0 Win=29200 Len=0 MSS=1460 SACK_PERM=1 TSval=1266818445 TSecr=0 WS=128
 1906 75.089380733 192.168.8.128 → 172.217.11.42 TCP 74 46650 → 443 [SYN] Seq=0 Win=29200 Len=0 MSS=1460 SACK_PERM=1 TSval=1284162704 TSecr=0 WS=128
 2022 89.300677224 192.168.8.128 → 192.168.8.1  TCP 74 58884 → 80 [SYN] Seq=0 Win=29200 Len=0 MSS=1460 SACK_PERM=1 TSval=1266835454 TSecr=0 WS=128
 2071 98.293666859 192.168.8.128 → 192.168.8.1  TCP 74 58886 → 80 [SYN] Seq=0 Win=29200 Len=0 MSS=1460 SACK_PERM=1 TSval=1266844446 TSecr=0 WS=128
 2116 106.308515051 192.168.8.128 → 192.168.8.1  TCP 74 58888 → 80 [SYN] Seq=0 Win=29200 Len=0 MSS=1460 SACK_PERM=1 TSval=1266852462 TSecr=0 WS=128
 2174 116.298272756 192.168.8.128 → 192.168.8.1  TCP 74 58890 → 80 [SYN] Seq=0 Win=29200 Len=0 MSS=1460 SACK_PERM=1 TSval=1266862451 TSecr=0 WS=128
 2187 116.983582010 192.168.8.128 → 35.186.241.40 TCP 74 60928 → 443 [SYN] Seq=0 Win=29200 Len=0 MSS=1460 SACK_PERM=1 TSval=2357823 TSecr=0 WS=128
 2213 117.314594751 192.168.8.128 → 172.217.10.5 TCP 74 36422 → 443 [SYN] Seq=0 Win=29200 Len=0 MSS=1460 SACK_PERM=1 TSval=587168158 TSecr=0 WS=128
 2279 124.305958908 192.168.8.128 → 192.168.8.1  TCP 74 58896 → 80 [SYN] Seq=0 Win=29200 Len=0 MSS=1460 SACK_PERM=1 TSval=1266870458 TSecr=0 WS=128
 2323 132.287079275 192.168.8.128 → 192.168.8.1  TCP 74 58898 → 80 [SYN] Seq=0 Win=29200 Len=0 MSS=1460 SACK_PERM=1 TSval=1266878439 TSecr=0 WS=128
 2416 149.307770424 192.168.8.128 → 192.168.8.1  TCP 74 58900 → 80 [SYN] Seq=0 Win=29200 Len=0 MSS=1460 SACK_PERM=1 TSval=1266895460 TSecr=0 WS=128
 2464 158.298471679 192.168.8.128 → 192.168.8.1  TCP 74 58902 → 80 [SYN] Seq=0 Win=29200 Len=0 MSS=1460 SACK_PERM=1 TSval=1266904450 TSecr=0 WS=128
 2517 166.283348814 192.168.8.128 → 192.168.8.1  TCP 74 58904 → 80 [SYN] Seq=0 Win=29200 Len=0 MSS=1460 SACK_PERM=1 TSval=1266912435 TSecr=0 WS=128
 2574 176.295367866 192.168.8.128 → 192.168.8.1  TCP 74 58906 → 80 [SYN] Seq=0 Win=29200 Len=0 MSS=1460 SACK_PERM=1 TSval=1266922447 TSecr=0 WS=128
 2617 184.302287686 192.168.8.128 → 192.168.8.1  TCP 74 58908 → 80 [SYN] Seq=0 Win=29200 Len=0 MSS=1460 SACK_PERM=1 TSval=1266930454 TSecr=0 WS=128
 2653 190.388307473 192.168.8.128 → 72.21.91.42  TCP 74 37988 → 443 [SYN] Seq=0 Win=29200 Len=0 MSS=1460 SACK_PERM=1 TSval=2286066423 TSecr=0 WS=128
 2680 193.299802659 192.168.8.128 → 192.168.8.1  TCP 74 58912 → 80 [SYN] Seq=0 Win=29200 Len=0 MSS=1460 SACK_PERM=1 TSval=1266939451 TSecr=0 WS=128
 2699 195.971085217 192.168.8.128 → 31.13.71.7   TCP 74 36700 → 443 [SYN] Seq=0 Win=29200 Len=0 MSS=1460 SACK_PERM=1 TSval=570036816 TSecr=0 WS=128
 2778 198.930879915 192.168.8.128 → 172.217.11.36 TCP 74 39648 → 443 [SYN] Seq=0 Win=29200 Len=0 MSS=1460 SACK_PERM=1 TSval=2802656452 TSecr=0 WS=128
 2879 201.216414283 192.168.8.128 → 173.194.185.168 TCP 74 39812 → 443 [SYN] Seq=0 Win=29200 Len=0 MSS=1460 SACK_PERM=1 TSval=950851401 TSecr=0 WS=128
 2985 202.232212224 192.168.8.128 → 172.217.7.14 TCP 74 59620 → 443 [SYN] Seq=0 Win=29200 Len=0 MSS=1460 SACK_PERM=1 TSval=2152309067 TSecr=0 WS=128
 3078 208.521656925 192.168.8.128 → 23.227.38.32 TCP 74 60846 → 443 [SYN] Seq=0 Win=29200 Len=0 MSS=1460 SACK_PERM=1 TSval=3464330652 TSecr=0 WS=128
 3132 209.017468013 192.168.8.128 → 199.232.36.104 TCP 74 35768 → 443 [SYN] Seq=0 Win=29200 Len=0 MSS=1460 SACK_PERM=1 TSval=1148079285 TSecr=0 WS=128
 3136 209.019390994 192.168.8.128 → 172.217.9.234 TCP 74 33534 → 443 [SYN] Seq=0 Win=29200 Len=0 MSS=1460 SACK_PERM=1 TSval=3479245483 TSecr=0 WS=128
 3142 209.023557952 192.168.8.128 → 199.232.36.104 TCP 74 35772 → 443 [SYN] Seq=0 Win=29200 Len=0 MSS=1460 SACK_PERM=1 TSval=1148079290 TSecr=0 WS=128
 3148 209.028761901 192.168.8.128 → 104.16.109.18 TCP 74 54834 → 443 [SYN] Seq=0 Win=29200 Len=0 MSS=1460 SACK_PERM=1 TSval=2148701944 TSecr=0 WS=128
 3181 209.052819662 192.168.8.128 → 172.217.12.180 TCP 74 45984 → 443 [SYN] Seq=0 Win=29200 Len=0 MSS=1460 SACK_PERM=1 TSval=4162769732 TSecr=0 WS=128
 3346 209.397311249 192.168.8.128 → 192.168.8.1  TCP 74 58934 → 80 [SYN] Seq=0 Win=29200 Len=0 MSS=1460 SACK_PERM=1 TSval=1266955549 TSecr=0 WS=128
 3358 209.486898361 192.168.8.128 → 172.217.12.170 TCP 74 38026 → 443 [SYN] Seq=0 Win=29200 Len=0 MSS=1460 SACK_PERM=1 TSval=3287224349 TSecr=0 WS=128
 3359 209.492651304 192.168.8.128 → 104.105.231.137 TCP 74 41422 → 443 [SYN] Seq=0 Win=29200 Len=0 MSS=1460 SACK_PERM=1 TSval=359559328 TSecr=0 WS=128
 3485 209.749593759 192.168.8.128 → 199.109.99.208 TCP 74 38416 → 443 [SYN] Seq=0 Win=29200 Len=0 MSS=1460 SACK_PERM=1 TSval=2194306744 TSecr=0 WS=128
 3572 210.131195978 192.168.8.128 → 23.111.9.35  TCP 74 38412 → 443 [SYN] Seq=0 Win=29200 Len=0 MSS=1460 SACK_PERM=1 TSval=4164170428 TSecr=0 WS=128
 3610 210.205201244 192.168.8.128 → 35.237.184.77 TCP 74 40450 → 443 [SYN] Seq=0 Win=29200 Len=0 MSS=1460 SACK_PERM=1 TSval=1960479740 TSecr=0 WS=128
 3611 210.205654240 192.168.8.128 → 35.237.184.77 TCP 74 40452 → 443 [SYN] Seq=0 Win=29200 Len=0 MSS=1460 SACK_PERM=1 TSval=1960479740 TSecr=0 WS=128
 3613 210.224396054 192.168.8.128 → 35.188.198.106 TCP 74 40320 → 443 [SYN] Seq=0 Win=29200 Len=0 MSS=1460 SACK_PERM=1 TSval=3799929141 TSecr=0 WS=128
 3614 210.224835050 192.168.8.128 → 35.188.198.106 TCP 74 40322 → 443 [SYN] Seq=0 Win=29200 Len=0 MSS=1460 SACK_PERM=1 TSval=3799929141 TSecr=0 WS=128
 3635 210.280784496 192.168.8.128 → 23.50.53.177 TCP 74 56516 → 80 [SYN] Seq=0 Win=29200 Len=0 MSS=1460 SACK_PERM=1 TSval=3520751222 TSecr=0 WS=128
 3636 210.281121492 192.168.8.128 → 23.50.53.177 TCP 74 56518 → 80 [SYN] Seq=0 Win=29200 Len=0 MSS=1460 SACK_PERM=1 TSval=3520751222 TSecr=0 WS=128
 3767 210.426621050 192.168.8.128 → 172.64.136.18 TCP 74 42250 → 443 [SYN] Seq=0 Win=29200 Len=0 MSS=1460 SACK_PERM=1 TSval=2087564629 TSecr=0 WS=128
 3829 210.504007284 192.168.8.128 → 104.106.244.206 TCP 74 33328 → 443 [SYN] Seq=0 Win=29200 Len=0 MSS=1460 SACK_PERM=1 TSval=709885255 TSecr=0 WS=128
 3830 210.504812276 192.168.8.128 → 13.225.218.41 TCP 74 35642 → 443 [SYN] Seq=0 Win=29200 Len=0 MSS=1460 SACK_PERM=1 TSval=2306950495 TSecr=0 WS=128
 3942 217.305741874 192.168.8.128 → 192.168.8.1  TCP 74 58962 → 80 [SYN] Seq=0 Win=29200 Len=0 MSS=1460 SACK_PERM=1 TSval=1266963457 TSecr=0 WS=128
 3993 225.302113587 192.168.8.128 → 192.168.8.1  TCP 74 58964 → 80 [SYN] Seq=0 Win=29200 Len=0 MSS=1460 SACK_PERM=1 TSval=1266971453 TSecr=0 WS=128
 4022 228.799835894 192.168.8.128 → 104.22.1.43  TCP 74 60572 → 443 [SYN] Seq=0 Win=29200 Len=0 MSS=1460 SACK_PERM=1 TSval=1215493666 TSecr=0 WS=128
 4186 241.297945866 192.168.8.128 → 192.168.8.1  TCP 74 58968 → 80 [SYN] Seq=0 Win=29200 Len=0 MSS=1460 SACK_PERM=1 TSval=1266987449 TSecr=0 WS=128
 4222 246.450161710 192.168.8.128 → 173.194.185.168 TCP 74 39864 → 443 [SYN] Seq=0 Win=29200 Len=0 MSS=1460 SACK_PERM=1 TSval=950896633 TSecr=0 WS=128
 4333 249.291790489 192.168.8.128 → 192.168.8.1  TCP 74 58972 → 80 [SYN] Seq=0 Win=29200 Len=0 MSS=1460 SACK_PERM=1 TSval=1266995442 TSecr=0 WS=128
 4404 257.293288999 192.168.8.128 → 192.168.8.1  TCP 74 58974 → 80 [SYN] Seq=0 Win=29200 Len=0 MSS=1460 SACK_PERM=1 TSval=1267003444 TSecr=0 WS=128
 4448 262.859364681 192.168.8.245 → 52.46.157.171 TCP 78 60558 → 443 [SYN] Seq=0 Win=65535 Len=0 MSS=1460 WS=128 TSval=859673827 TSecr=0 SACK_PERM=1
 4449 262.864020635 192.168.8.245 → 52.46.157.171 TCP 78 60559 → 443 [SYN] Seq=0 Win=65535 Len=0 MSS=1460 WS=128 TSval=859673831 TSecr=0 SACK_PERM=1
 4450 262.865149624 192.168.8.245 → 52.46.157.171 TCP 78 60560 → 443 [SYN] Seq=0 Win=65535 Len=0 MSS=1460 WS=128 TSval=859673832 TSecr=0 SACK_PERM=1
 4451 262.868771588 192.168.8.245 → 72.21.206.140 TCP 78 60561 → 443 [SYN] Seq=0 Win=65535 Len=0 MSS=1460 WS=128 TSval=859673836 TSecr=0 SACK_PERM=1
 4500 263.090638383 192.168.8.245 → 52.46.157.171 TCP 78 60562 → 443 [SYN] Seq=0 Win=65535 Len=0 MSS=1460 WS=128 TSval=859674043 TSecr=0 SACK_PERM=1
 4515 263.162822665 192.168.8.245 → 52.46.157.171 TCP 78 60563 → 443 [SYN] Seq=0 Win=65535 Len=0 MSS=1460 WS=128 TSval=859674109 TSecr=0 SACK_PERM=1
 4518 263.188914406 192.168.8.245 → 52.46.157.171 TCP 78 60564 → 443 [SYN] Seq=0 Win=65535 Len=0 MSS=1460 WS=128 TSval=859674111 TSecr=0 SACK_PERM=1
 4658 273.291836953 192.168.8.128 → 192.168.8.1  TCP 74 58976 → 80 [SYN] Seq=0 Win=29200 Len=0 MSS=1460 SACK_PERM=1 TSval=1267019442 TSecr=0 WS=128
 4677 275.874889260 192.168.8.245 → 72.21.206.140 TCP 78 60565 → 443 [SYN] Seq=0 Win=65535 Len=0 MSS=1460 WS=128 TSval=859686776 TSecr=0 SACK_PERM=1
 4678 275.875281256 192.168.8.245 → 52.46.157.171 TCP 78 60566 → 443 [SYN] Seq=0 Win=65535 Len=0 MSS=1460 WS=128 TSval=859686782 TSecr=0 SACK_PERM=1
 4679 275.879064219 192.168.8.245 → 52.46.157.171 TCP 78 60567 → 443 [SYN] Seq=0 Win=65535 Len=0 MSS=1460 WS=128 TSval=859686783 TSecr=0 SACK_PERM=1
 4716 276.139584627 192.168.8.245 → 52.46.157.171 TCP 78 60568 → 443 [SYN] Seq=0 Win=65535 Len=0 MSS=1460 WS=128 TSval=859687044 TSecr=0 SACK_PERM=1
 4739 276.383595200 192.168.8.245 → 52.46.157.171 TCP 78 60569 → 443 [SYN] Seq=0 Win=65535 Len=0 MSS=1460 WS=128 TSval=859687278 TSecr=0 SACK_PERM=1
 4798 281.295908328 192.168.8.128 → 192.168.8.1  TCP 74 58978 → 80 [SYN] Seq=0 Win=29200 Len=0 MSS=1460 SACK_PERM=1 TSval=1267027446 TSecr=0 WS=128
 4854 289.294450723 192.168.8.128 → 192.168.8.1  TCP 74 58980 → 80 [SYN] Seq=0 Win=29200 Len=0 MSS=1460 SACK_PERM=1 TSval=1267035444 TSecr=0 WS=128
 4897 294.861760295 192.168.8.245 → 17.56.140.32 TCP 78 60570 → 443 [SYN] Seq=0 Win=65535 Len=0 MSS=1460 WS=128 TSval=859704006 TSecr=0 SACK_PERM=1
 4915 295.450567431 192.168.8.245 → 17.142.169.199 TCP 78 60571 → 443 [SYN] Seq=0 Win=65535 Len=0 MSS=1460 WS=128 TSval=859704586 TSecr=0 SACK_PERM=1
 5000 305.295500371 192.168.8.128 → 192.168.8.1  TCP 74 58982 → 80 [SYN] Seq=0 Win=29200 Len=0 MSS=1460 SACK_PERM=1 TSval=1267051445 TSecr=0 WS=128
 5052 313.294157663 192.168.8.128 → 192.168.8.1  TCP 74 58984 → 80 [SYN] Seq=0 Win=29200 Len=0 MSS=1460 SACK_PERM=1 TSval=1267059444 TSecr=0 WS=128
 5096 321.296528885 192.168.8.128 → 192.168.8.1  TCP 74 58986 → 80 [SYN] Seq=0 Win=29200 Len=0 MSS=1460 SACK_PERM=1 TSval=1267067446 TSecr=0 WS=128
 5109 321.683632025 192.168.8.128 → 34.212.28.14 TCP 74 58354 → 443 [SYN] Seq=0 Win=29200 Len=0 MSS=1460 SACK_PERM=1 TSval=3843606524 TSecr=0 WS=128
 5131 322.175986116 192.168.8.128 → 52.11.86.147 TCP 74 43780 → 443 [SYN] Seq=0 Win=29200 Len=0 MSS=1460 SACK_PERM=1 TSval=3480302445 TSecr=0 WS=128
 5191 322.811622777 192.168.8.128 → 199.232.36.104 TCP 74 35836 → 443 [SYN] Seq=0 Win=29200 Len=0 MSS=1460 SACK_PERM=1 TSval=1148193077 TSecr=0 WS=128
 5220 323.099199909 192.168.8.128 → 34.95.71.207 TCP 74 48198 → 443 [SYN] Seq=0 Win=29200 Len=0 MSS=1460 SACK_PERM=1 TSval=2302208112 TSecr=0 WS=128
 5442 337.295522290 192.168.8.128 → 192.168.8.1  TCP 74 58996 → 80 [SYN] Seq=0 Win=29200 Len=0 MSS=1460 SACK_PERM=1 TSval=1267083444 TSecr=0 WS=128
 5497 345.295101444 192.168.8.128 → 192.168.8.1  TCP 74 58998 → 80 [SYN] Seq=0 Win=29200 Len=0 MSS=1460 SACK_PERM=1 TSval=1267091445 TSecr=0 WS=128
 5549 353.312031394 192.168.8.128 → 192.168.8.1  TCP 74 59000 → 80 [SYN] Seq=0 Win=29200 Len=0 MSS=1460 SACK_PERM=1 TSval=1267099461 TSecr=0 WS=128
 5577 355.800933535 192.168.8.128 → 172.217.10.14 TCP 74 57160 → 443 [SYN] Seq=0 Win=29200 Len=0 MSS=1460 SACK_PERM=1 TSval=320329984 TSecr=0 WS=128
 5666 369.305257608 192.168.8.128 → 192.168.8.1  TCP 74 59004 → 80 [SYN] Seq=0 Win=29200 Len=0 MSS=1460 SACK_PERM=1 TSval=1267115454 TSecr=0 WS=128
 5715 376.280363884 192.168.8.128 → 104.20.38.240 TCP 74 56350 → 443 [SYN] Seq=0 Win=29200 Len=0 MSS=1460 SACK_PERM=1 TSval=1808677812 TSecr=0 WS=128
 5758 376.905296636 192.168.8.128 → 104.20.39.240 TCP 74 52598 → 443 [SYN] Seq=0 Win=29200 Len=0 MSS=1460 SACK_PERM=1 TSval=2236799814 TSecr=0 WS=128
 5759 376.905635632 192.168.8.128 → 104.20.39.240 TCP 74 52600 → 443 [SYN] Seq=0 Win=29200 Len=0 MSS=1460 SACK_PERM=1 TSval=2236799814 TSecr=0 WS=128
 5760 376.905961629 192.168.8.128 → 104.20.39.240 TCP 74 52602 → 443 [SYN] Seq=0 Win=29200 Len=0 MSS=1460 SACK_PERM=1 TSval=2236799814 TSecr=0 WS=128
 5761 376.906297626 192.168.8.128 → 104.20.39.240 TCP 74 52604 → 443 [SYN] Seq=0 Win=29200 Len=0 MSS=1460 SACK_PERM=1 TSval=2236799814 TSecr=0 WS=128
 5762 376.906728621 192.168.8.128 → 104.20.39.240 TCP 74 52606 → 443 [SYN] Seq=0 Win=29200 Len=0 MSS=1460 SACK_PERM=1 TSval=2236799814 TSecr=0 WS=128
 5764 376.907413614 192.168.8.128 → 104.20.39.240 TCP 74 52608 → 443 [SYN] Seq=0 Win=29200 Len=0 MSS=1460 SACK_PERM=1 TSval=2236799814 TSecr=0 WS=128
 5778 376.928647402 192.168.8.128 → 104.20.38.240 TCP 74 56364 → 443 [SYN] Seq=0 Win=29200 Len=0 MSS=1460 SACK_PERM=1 TSval=1808678452 TSecr=0 WS=128
 5932 377.298056709 192.168.8.128 → 192.168.8.1  TCP 74 59022 → 80 [SYN] Seq=0 Win=29200 Len=0 MSS=1460 SACK_PERM=1 TSval=1267123439 TSecr=0 WS=128
 5939 377.377314916 192.168.8.128 → 104.20.39.240 TCP 74 52614 → 443 [SYN] Seq=0 Win=29200 Len=0 MSS=1460 SACK_PERM=1 TSval=2236800286 TSecr=0 WS=128
 6081 385.297554713 192.168.8.128 → 192.168.8.1  TCP 74 59026 → 80 [SYN] Seq=0 Win=29200 Len=0 MSS=1460 SACK_PERM=1 TSval=1267131446 TSecr=0 WS=128
 6191 401.298230621 192.168.8.128 → 192.168.8.1  TCP 74 59028 → 80 [SYN] Seq=0 Win=29200 Len=0 MSS=1460 SACK_PERM=1 TSval=1267147447 TSecr=0 WS=128
 6234 409.302895489 192.168.8.128 → 192.168.8.1  TCP 74 59030 → 80 [SYN] Seq=0 Win=29200 Len=0 MSS=1460 SACK_PERM=1 TSval=1267155449 TSecr=0 WS=128
 6276 417.298672419 192.168.8.128 → 192.168.8.1  TCP 74 59032 → 80 [SYN] Seq=0 Win=29200 Len=0 MSS=1460 SACK_PERM=1 TSval=1267163446 TSecr=0 WS=128
 6311 421.765134680 192.168.8.128 → 172.217.12.206 TCP 74 59312 → 443 [SYN] Seq=0 Win=29200 Len=0 MSS=1460 SACK_PERM=1 TSval=465096704 TSecr=0 WS=128
 6402 433.296975131 192.168.8.128 → 192.168.8.1  TCP 74 59036 → 80 [SYN] Seq=0 Win=29200 Len=0 MSS=1460 SACK_PERM=1 TSval=1267179444 TSecr=0 WS=128
 6518 472.889380012 192.168.8.128 → 192.168.8.1  TCP 74 59038 → 80 [SYN] Seq=0 Win=29200 Len=0 MSS=1460 SACK_PERM=1 TSval=1267219036 TSecr=0 WS=128
 7172 481.085195731 192.168.8.128 → 192.168.8.1  TCP 74 59046 → 80 [SYN] Seq=0 Win=29200 Len=0 MSS=1460 SACK_PERM=1 TSval=1267227228 TSecr=0 WS=128
 7173 481.085509727 192.168.8.128 → 192.168.8.1  TCP 74 59044 → 80 [SYN] Seq=0 Win=29200 Len=0 MSS=1460 SACK_PERM=1 TSval=1267227228 TSecr=0 WS=128
 7576 489.117175070 192.168.8.128 → 199.109.99.201 TCP 74 56814 → 80 [SYN] Seq=0 Win=29200 Len=0 MSS=1460 SACK_PERM=1 TSval=2658610801 TSecr=0 WS=128
 7577 489.120045041 192.168.8.128 → 199.109.99.201 TCP 74 56816 → 80 [SYN] Seq=0 Win=29200 Len=0 MSS=1460 SACK_PERM=1 TSval=2658610803 TSecr=0 WS=128
 7588 489.128866953 192.168.8.128 → 172.217.197.189 TCP 74 58244 → 443 [SYN] Seq=0 Win=29200 Len=0 MSS=1460 SACK_PERM=1 TSval=163473097 TSecr=0 WS=128
 7597 489.141634824 192.168.8.128 → 31.13.71.36  TCP 74 59098 → 443 [SYN] Seq=0 Win=29200 Len=0 MSS=1460 SACK_PERM=1 TSval=801716849 TSecr=0 WS=128
 7600 489.144517796 192.168.8.128 → 35.186.241.40 TCP 74 32864 → 443 [SYN] Seq=0 Win=29200 Len=0 MSS=1460 SACK_PERM=1 TSval=2729977 TSecr=0 WS=128
 7603 489.146223778 192.168.8.128 → 172.217.12.206 TCP 74 59340 → 443 [SYN] Seq=0 Win=29200 Len=0 MSS=1460 SACK_PERM=1 TSval=465164082 TSecr=0 WS=128
 7611 489.151875722 192.168.8.128 → 172.217.12.197 TCP 74 55098 → 443 [SYN] Seq=0 Win=29200 Len=0 MSS=1460 SACK_PERM=1 TSval=3211759448 TSecr=0 WS=128
 7635 489.175246487 192.168.8.128 → 34.212.28.14 TCP 74 58432 → 443 [SYN] Seq=0 Win=29200 Len=0 MSS=1460 SACK_PERM=1 TSval=3843774011 TSecr=0 WS=128
 7636 489.175562484 192.168.8.128 → 31.13.71.1   TCP 74 52676 → 443 [SYN] Seq=0 Win=29200 Len=0 MSS=1460 SACK_PERM=1 TSval=3816568493 TSecr=0 WS=128
 7637 489.175890480 192.168.8.128 → 192.241.191.80 TCP 74 50240 → 443 [SYN] Seq=0 Win=29200 Len=0 MSS=1460 SACK_PERM=1 TSval=3932074464 TSecr=0 WS=128
 7657 489.185821381 192.168.8.128 → 31.13.71.1   TCP 74 52680 → 443 [SYN] Seq=0 Win=29200 Len=0 MSS=1460 SACK_PERM=1 TSval=3816568505 TSecr=0 WS=128
 7661 489.188059358 192.168.8.128 → 54.149.145.192 TCP 74 43654 → 443 [SYN] Seq=0 Win=29200 Len=0 MSS=1460 SACK_PERM=1 TSval=3081970315 TSecr=0 WS=128
 7691 489.205822180 192.168.8.128 → 173.194.184.232 TCP 74 47388 → 443 [SYN] Seq=0 Win=29200 Len=0 MSS=1460 SACK_PERM=1 TSval=235088781 TSecr=0 WS=128
 7744 489.230578931 192.168.8.128 → 31.13.71.1   TCP 74 52686 → 443 [SYN] Seq=0 Win=29200 Len=0 MSS=1460 SACK_PERM=1 TSval=3816568544 TSecr=0 WS=128
 7897 489.404350186 192.168.8.128 → 173.194.184.232 TCP 74 47392 → 443 [SYN] Seq=0 Win=29200 Len=0 MSS=1460 SACK_PERM=1 TSval=235088980 TSecr=0 WS=128
 7898 489.404642183 192.168.8.128 → 173.194.184.232 TCP 74 47394 → 443 [SYN] Seq=0 Win=29200 Len=0 MSS=1460 SACK_PERM=1 TSval=235088980 TSecr=0 WS=128
 8087 489.710763108 192.168.8.128 → 52.11.86.147 TCP 74 43874 → 443 [SYN] Seq=0 Win=29200 Len=0 MSS=1460 SACK_PERM=1 TSval=3480469976 TSecr=0 WS=128
 8088 489.724459971 192.168.8.128 → 192.168.8.1  TCP 74 59086 → 80 [SYN] Seq=0 Win=29200 Len=0 MSS=1460 SACK_PERM=1 TSval=1267235871 TSecr=0 WS=128
 8208 490.448304700 192.168.8.128 → 104.20.38.240 TCP 74 56432 → 443 [SYN] Seq=0 Win=29200 Len=0 MSS=1460 SACK_PERM=1 TSval=1808791978 TSecr=0 WS=128
 8348 490.712429047 192.168.8.128 → 172.217.3.99 TCP 74 42810 → 443 [SYN] Seq=0 Win=29200 Len=0 MSS=1460 SACK_PERM=1 TSval=4110509992 TSecr=0 WS=128
 8384 490.812791039 192.168.8.128 → 104.20.38.240 TCP 74 56436 → 443 [SYN] Seq=0 Win=29200 Len=0 MSS=1460 SACK_PERM=1 TSval=1808792339 TSecr=0 WS=128
 8397 490.856539600 192.168.8.128 → 34.95.71.207 TCP 74 48298 → 443 [SYN] Seq=0 Win=29200 Len=0 MSS=1460 SACK_PERM=1 TSval=2302375866 TSecr=0 WS=128
 8705 498.707938725 192.168.8.128 → 192.168.8.1  TCP 74 59096 → 80 [SYN] Seq=0 Win=29200 Len=0 MSS=1460 SACK_PERM=1 TSval=1267244854 TSecr=0 WS=128
 8797 503.559395976 192.168.8.128 → 74.125.192.189 TCP 74 57152 → 443 [SYN] Seq=0 Win=29200 Len=0 MSS=1460 SACK_PERM=1 TSval=571576046 TSecr=0 WS=128
 8857 506.710988304 192.168.8.128 → 192.168.8.1  TCP 74 59100 → 80 [SYN] Seq=0 Win=29200 Len=0 MSS=1460 SACK_PERM=1 TSval=1267252857 TSecr=0 WS=128
 8871 507.411288266 192.168.8.128 → 172.217.6.238 TCP 74 55866 → 443 [SYN] Seq=0 Win=29200 Len=0 MSS=1460 SACK_PERM=1 TSval=252883099 TSecr=0 WS=128
 8904 507.775992600 192.168.8.128 → 31.13.71.7   TCP 74 36890 → 443 [SYN] Seq=0 Win=29200 Len=0 MSS=1460 SACK_PERM=1 TSval=570348612 TSecr=0 WS=128
 8968 510.583090386 192.168.8.128 → 192.241.191.80 TCP 74 50276 → 443 [SYN] Seq=0 Win=29200 Len=0 MSS=1460 SACK_PERM=1 TSval=3932095873 TSecr=0 WS=128
 9008 514.074919286 192.168.8.128 → 31.13.71.1   TCP 74 52716 → 443 [SYN] Seq=0 Win=29200 Len=0 MSS=1460 SACK_PERM=1 TSval=3816593394 TSecr=0 WS=128
 9122 516.943063451 192.168.8.128 → 172.217.3.99 TCP 74 42830 → 443 [SYN] Seq=0 Win=29200 Len=0 MSS=1460 SACK_PERM=1 TSval=4110536222 TSecr=0 WS=128
 9200 522.735985205 192.168.8.128 → 192.168.8.1  TCP 74 59112 → 80 [SYN] Seq=0 Win=29200 Len=0 MSS=1460 SACK_PERM=1 TSval=1267268881 TSecr=0 WS=128
 9264 530.735292755 192.168.8.128 → 192.168.8.1  TCP 74 59114 → 80 [SYN] Seq=0 Win=29200 Len=0 MSS=1460 SACK_PERM=1 TSval=1267276881 TSecr=0 WS=128
 9303 534.899657865 192.168.8.128 → 35.186.241.40 TCP 74 32920 → 443 [SYN] Seq=0 Win=29200 Len=0 MSS=1460 SACK_PERM=1 TSval=2775723 TSecr=0 WS=128
 9366 538.725145378 192.168.8.128 → 192.168.8.1  TCP 74 59118 → 80 [SYN] Seq=0 Win=29200 Len=0 MSS=1460 SACK_PERM=1 TSval=1267284871 TSecr=0 WS=128
 9514 554.730963299 192.168.8.128 → 192.168.8.1  TCP 74 59120 → 80 [SYN] Seq=0 Win=29200 Len=0 MSS=1460 SACK_PERM=1 TSval=1267300876 TSecr=0 WS=128
 9572 562.720561863 192.168.8.128 → 192.168.8.1  TCP 74 59122 → 80 [SYN] Seq=0 Win=29200 Len=0 MSS=1460 SACK_PERM=1 TSval=1267308866 TSecr=0 WS=128
 9616 568.146984220 192.168.8.128 → 172.217.12.206 TCP 74 59402 → 443 [SYN] Seq=0 Win=29200 Len=0 MSS=1460 SACK_PERM=1 TSval=465243081 TSecr=0 WS=128
 9667 570.721225295 192.168.8.128 → 192.168.8.1  TCP 74 59126 → 80 [SYN] Seq=0 Win=29200 Len=0 MSS=1460 SACK_PERM=1 TSval=1267316866 TSecr=0 WS=128
 9737 578.722821697 192.168.8.128 → 192.168.8.1  TCP 74 59128 → 80 [SYN] Seq=0 Win=29200 Len=0 MSS=1460 SACK_PERM=1 TSval=1267324868 TSecr=0 WS=128
 9811 586.737762945 192.168.8.128 → 192.168.8.1  TCP 74 59130 → 80 [SYN] Seq=0 Win=29200 Len=0 MSS=1460 SACK_PERM=1 TSval=1267332882 TSecr=0 WS=128
 9885 594.728184422 192.168.8.128 → 192.168.8.1  TCP 74 59132 → 80 [SYN] Seq=0 Win=29200 Len=0 MSS=1460 SACK_PERM=1 TSval=1267340869 TSecr=0 WS=128
 9949 597.251984984 192.168.8.128 → 74.125.174.140 TCP 74 53158 → 443 [SYN] Seq=0 Win=29200 Len=0 MSS=1460 SACK_PERM=1 TSval=4032539140 TSecr=0 WS=128
 9950 597.252336980 192.168.8.128 → 74.125.174.140 TCP 74 53160 → 443 [SYN] Seq=0 Win=29200 Len=0 MSS=1460 SACK_PERM=1 TSval=4032539140 TSecr=0 WS=128
10134 601.721699929 192.168.8.128 → 192.168.8.1  TCP 74 59138 → 80 [SYN] Seq=0 Win=29200 Len=0 MSS=1460 SACK_PERM=1 TSval=1267347865 TSecr=0 WS=128
10203 610.835895038 192.168.8.128 → 192.168.8.1  TCP 74 59140 → 80 [SYN] Seq=0 Win=29200 Len=0 MSS=1460 SACK_PERM=1 TSval=1267356980 TSecr=0 WS=128
10253 618.836609354 192.168.8.128 → 192.168.8.1  TCP 74 59142 → 80 [SYN] Seq=0 Win=29200 Len=0 MSS=1460 SACK_PERM=1 TSval=1267364981 TSecr=0 WS=128
10303 626.821062816 192.168.8.128 → 192.168.8.1  TCP 74 59144 → 80 [SYN] Seq=0 Win=29200 Len=0 MSS=1460 SACK_PERM=1 TSval=1267372965 TSecr=0 WS=128
10464 642.839743184 192.168.8.128 → 192.168.8.1  TCP 74 59146 → 80 [SYN] Seq=0 Win=29200 Len=0 MSS=1460 SACK_PERM=1 TSval=1267388983 TSecr=0 WS=128
10509 649.819875732 192.168.8.128 → 13.225.231.227 TCP 74 53770 → 443 [SYN] Seq=0 Win=29200 Len=0 MSS=1460 SACK_PERM=1 TSval=3133121464 TSecr=0 WS=128
10588 650.163671261 192.168.8.128 → 54.192.54.91 TCP 74 48260 → 443 [SYN] Seq=0 Win=29200 Len=0 MSS=1460 SACK_PERM=1 TSval=3806157774 TSecr=0 WS=128
10663 650.860833224 192.168.8.128 → 192.168.8.1  TCP 74 59152 → 80 [SYN] Seq=0 Win=29200 Len=0 MSS=1460 SACK_PERM=1 TSval=1267397005 TSecr=0 WS=128
10673 650.939496430 192.168.8.128 → 18.214.236.42 TCP 74 57296 → 443 [SYN] Seq=0 Win=29200 Len=0 MSS=1460 SACK_PERM=1 TSval=3852386398 TSecr=0 WS=128
10766 651.335292434 192.168.8.128 → 54.239.17.86 TCP 74 47824 → 443 [SYN] Seq=0 Win=29200 Len=0 MSS=1460 SACK_PERM=1 TSval=1530461433 TSecr=0 WS=128
10788 651.408238698 192.168.8.128 → 52.46.133.100 TCP 74 59904 → 443 [SYN] Seq=0 Win=29200 Len=0 MSS=1460 SACK_PERM=1 TSval=271982010 TSecr=0 WS=128
10884 658.861557452 192.168.8.128 → 192.168.8.1  TCP 74 59160 → 80 [SYN] Seq=0 Win=29200 Len=0 MSS=1460 SACK_PERM=1 TSval=1267405005 TSecr=0 WS=128
10908 660.748044404 192.168.8.128 → 54.192.54.91 TCP 74 48272 → 443 [SYN] Seq=0 Win=29200 Len=0 MSS=1460 SACK_PERM=1 TSval=3806168359 TSecr=0 WS=128
10973 670.736224539 192.168.8.128 → 54.192.54.91 TCP 74 48274 → 443 [SYN] Seq=0 Win=29200 Len=0 MSS=1460 SACK_PERM=1 TSval=3806178348 TSecr=0 WS=128
11016 674.872719759 192.168.8.128 → 192.168.8.1  TCP 74 59166 → 80 [SYN] Seq=0 Win=29200 Len=0 MSS=1460 SACK_PERM=1 TSval=1267421016 TSecr=0 WS=128
11073 682.862161052 192.168.8.128 → 192.168.8.1  TCP 74 59168 → 80 [SYN] Seq=0 Win=29200 Len=0 MSS=1460 SACK_PERM=1 TSval=1267429005 TSecr=0 WS=128
11122 690.869571147 192.168.8.128 → 192.168.8.1  TCP 74 59170 → 80 [SYN] Seq=0 Win=29200 Len=0 MSS=1460 SACK_PERM=1 TSval=1267437013 TSecr=0 WS=128
11207 706.864540490 192.168.8.128 → 192.168.8.1  TCP 74 59172 → 80 [SYN] Seq=0 Win=29200 Len=0 MSS=1460 SACK_PERM=1 TSval=1267453007 TSecr=0 WS=128
11256 714.874469513 192.168.8.128 → 192.168.8.1  TCP 74 59174 → 80 [SYN] Seq=0 Win=29200 Len=0 MSS=1460 SACK_PERM=1 TSval=1267461017 TSecr=0 WS=128
11332 723.877903473 192.168.8.128 → 192.168.8.1  TCP 74 59176 → 80 [SYN] Seq=0 Win=29200 Len=0 MSS=1460 SACK_PERM=1 TSval=1267470019 TSecr=0 WS=128
11368 728.081283964 192.168.8.245 → 172.217.10.74 TCP 78 57168 → 443 [SYN] Seq=0 Win=65535 Len=0 MSS=1460 WS=128 TSval=860139841 TSecr=0 SACK_PERM=1
11413 731.871675628 192.168.8.128 → 192.168.8.1  TCP 74 59178 → 80 [SYN] Seq=0 Win=29200 Len=0 MSS=1460 SACK_PERM=1 TSval=1267478012 TSecr=0 WS=128
11460 739.861752805 192.168.8.128 → 192.168.8.1  TCP 74 59180 → 80 [SYN] Seq=0 Win=29200 Len=0 MSS=1460 SACK_PERM=1 TSval=1267486004 TSecr=0 WS=128
11539 747.863246852 192.168.8.128 → 192.168.8.1  TCP 74 59182 → 80 [SYN] Seq=0 Win=29200 Len=0 MSS=1460 SACK_PERM=1 TSval=1267494004 TSecr=0 WS=128
11579 754.889112759 192.168.8.128 → 192.168.8.1  TCP 74 59184 → 80 [SYN] Seq=0 Win=29200 Len=0 MSS=1460 SACK_PERM=1 TSval=1267501032 TSecr=0 WS=128
11639 763.970914846 192.168.8.128 → 192.168.8.1  TCP 74 59186 → 80 [SYN] Seq=0 Win=29200 Len=0 MSS=1460 SACK_PERM=1 TSval=1267510113 TSecr=0 WS=128
11689 771.975086824 192.168.8.128 → 192.168.8.1  TCP 74 59188 → 80 [SYN] Seq=0 Win=29200 Len=0 MSS=1460 SACK_PERM=1 TSval=1267518117 TSecr=0 WS=128
11731 779.974405839 192.168.8.128 → 192.168.8.1  TCP 74 59190 → 80 [SYN] Seq=0 Win=29200 Len=0 MSS=1460 SACK_PERM=1 TSval=1267526116 TSecr=0 WS=128
11823 795.988087675 192.168.8.128 → 192.168.8.1  TCP 74 59192 → 80 [SYN] Seq=0 Win=29200 Len=0 MSS=1460 SACK_PERM=1 TSval=1267542130 TSecr=0 WS=128
11863 802.693242760 192.168.8.245 → 54.239.17.112 TCP 78 57169 → 443 [SYN] Seq=0 Win=65535 Len=0 MSS=1460 WS=128 TSval=860213573 TSecr=0 SACK_PERM=1
11864 802.694730745 192.168.8.245 → 52.46.157.171 TCP 78 57170 → 443 [SYN] Seq=0 Win=65535 Len=0 MSS=1460 WS=128 TSval=860213574 TSecr=0 SACK_PERM=1
11892 802.858783083 192.168.8.245 → 17.249.121.246 TCP 78 57171 → 443 [SYN] Seq=0 Win=65535 Len=0 MSS=1460 WS=128 TSval=860214777 TSecr=0 SACK_PERM=1
11906 802.919807465 192.168.8.245 → 17.249.121.246 TCP 78 57172 → 443 [SYN] Seq=0 Win=65535 Len=0 MSS=1460 WS=128 TSval=860214831 TSecr=0 SACK_PERM=1
11939 803.983296692 192.168.8.128 → 192.168.8.1  TCP 74 59194 → 80 [SYN] Seq=0 Win=29200 Len=0 MSS=1460 SACK_PERM=1 TSval=1267550125 TSecr=0 WS=128
12001 811.987563604 192.168.8.128 → 192.168.8.1  TCP 74 59196 → 80 [SYN] Seq=0 Win=29200 Len=0 MSS=1460 SACK_PERM=1 TSval=1267558129 TSecr=0 WS=128
12046 818.197944681 192.168.8.245 → 104.97.144.169 TCP 78 57173 → 443 [SYN] Seq=0 Win=65535 Len=0 MSS=1460 WS=128 TSval=860186127 TSecr=0 SACK_PERM=1
12130 827.984173513 192.168.8.128 → 192.168.8.1  TCP 74 59198 → 80 [SYN] Seq=0 Win=29200 Len=0 MSS=1460 SACK_PERM=1 TSval=1267574125 TSecr=0 WS=128
12177 835.989019002 192.168.8.128 → 192.168.8.1  TCP 74 59200 → 80 [SYN] Seq=0 Win=29200 Len=0 MSS=1460 SACK_PERM=1 TSval=1267582129 TSecr=0 WS=128
12195 837.392574713 192.168.8.128 → 172.217.11.42 TCP 74 46970 → 443 [SYN] Seq=0 Win=29200 Len=0 MSS=1460 SACK_PERM=1 TSval=1284924995 TSecr=0 WS=128
12265 843.995740395 192.168.8.128 → 192.168.8.1  TCP 74 59204 → 80 [SYN] Seq=0 Win=29200 Len=0 MSS=1460 SACK_PERM=1 TSval=1267590131 TSecr=0 WS=128
12297 848.318440934 192.168.8.128 → 23.217.149.114 TCP 74 51684 → 443 [SYN] Seq=0 Win=29200 Len=0 MSS=1460 SACK_PERM=1 TSval=4116019750 TSecr=0 WS=128
12398 859.292864316 192.168.8.128 → 13.225.231.227 TCP 74 53830 → 443 [SYN] Seq=0 Win=29200 Len=0 MSS=1460 SACK_PERM=1 TSval=3133330936 TSecr=0 WS=128
12424 859.995585940 192.168.8.128 → 192.168.8.1  TCP 74 59210 → 80 [SYN] Seq=0 Win=29200 Len=0 MSS=1460 SACK_PERM=1 TSval=1267606136 TSecr=0 WS=128
12468 867.999123843 192.168.8.128 → 192.168.8.1  TCP 74 59212 → 80 [SYN] Seq=0 Win=29200 Len=0 MSS=1460 SACK_PERM=1 TSval=1267614140 TSecr=0 WS=128
12535 876.998751775 192.168.8.128 → 192.168.8.1  TCP 74 59214 → 80 [SYN] Seq=0 Win=29200 Len=0 MSS=1460 SACK_PERM=1 TSval=1267623138 TSecr=0 WS=128
12906 884.988575295 192.168.8.128 → 192.168.8.1  TCP 74 59216 → 80 [SYN] Seq=0 Win=29200 Len=0 MSS=1460 SACK_PERM=1 TSval=1267631128 TSecr=0 WS=128
12980 892.994475569 192.168.8.128 → 192.168.8.1  TCP 74 59218 → 80 [SYN] Seq=0 Win=29200 Len=0 MSS=1460 SACK_PERM=1 TSval=1267639129 TSecr=0 WS=128
13389 900.991315082 192.168.8.128 → 192.168.8.1  TCP 74 59220 → 80 [SYN] Seq=0 Win=29200 Len=0 MSS=1460 SACK_PERM=1 TSval=1267647132 TSecr=0 WS=128
13455 908.008484870 192.168.8.128 → 192.168.8.1  TCP 74 59222 → 80 [SYN] Seq=0 Win=29200 Len=0 MSS=1460 SACK_PERM=1 TSval=1267654149 TSecr=0 WS=128
